{
  "v": "JOKER-REQUEST-1",
  "request_id": "22222222-2222-2222-2222-222222222222",
  "ts": "2026-03-02T11:00:00Z",
  "ipr_subject": "IPR-USER-0002",
  "intent": {
    "kind": "EXECUTE_EXTERNAL",
    "summary": "Attempt an external action (should be denied by default policy).",
    "risk_hint": "HIGH"
  },
  "scope": {
    "domain": "governance",
    "tools_allowed": ["external_exec"],
    "limits": {
      "max_steps": 10,
      "max_duration_ms": 5000,
      "max_cost": 0
    }
  },
  "params": {
    "target": "example.com",
    "action": "PING"
  }
}
