{
  "v": "JOKER-REQUEST-1",
  "request_id": "11111111-1111-1111-1111-111111111111",
  "ts": "2026-03-02T10:00:00Z",
  "ipr_subject": "IPR-USER-0001",
  "intent": {
    "kind": "READ_ONLY",
    "summary": "Retrieve internal policy metadata",
    "risk_hint": "LOW"
  },
  "scope": {
    "domain": "governance",
    "tools_allowed": ["policy_reader"],
    "limits": {
      "max_steps": 10,
      "max_duration_ms": 5000,
      "max_cost": 0
    }
  },
  "params": {}
}
